{
  "schema_version": 1,
  "id": "proposal-001",
  "delegation_id": "delegation-001",
  "run_id": "run-001",
  "phase": "plan",
  "authority": "advisory",
  "capability_class": "balanced",
  "reasoning_effort": "medium",
  "task_signature": {},
  "mode": "inherit",
  "policy": "balanced",
  "concrete_model": null,
  "availability": "unverified",
  "git_fingerprint": "unverified",
  "config_digest": "unverified",
  "mapping_digest": "unverified",
  "harness": "unverified",
  "harness_version": "unverified",
  "capability_digest": "unverified",
  "catalog_digest": "unverified",
  "explicit_override_digest": "none",
  "input_fingerprint": "0000000000000000000000000000000000000000000000000000000000000000",
  "supersedes": null,
  "superseded_by": null,
  "status": "active",
  "created_at": "2026-08-04T00:00:00.000Z"
}
